4.90333E+12,111,ロッテ　バッカス　１０粒,200,20201013,10,9,６ヶ月,6,58,188,438,294,7300,砂糖、植物油脂、全粉乳、水あめ、ブランデー（コニャック６０％）、カカオマス、乳糖、ココアバター／乳化剤（大豆由来）、香料、増粘剤（ブドウ糖多糖）、カラメル色素,,１粒（標準５．７ｇ）,29,0.24,1.7,2.9,0,,無,90,138,16,
4.90333E+12,111,＄ロッテガーナマリアージュストロベリー　６４ｇ,250,20200407,6,12,１２ヶ月,12,66,242,450,320,7850,砂糖、全粉乳、ココアバター、カカオマス、植物油脂、乳糖、脱脂粉乳、苺加工品、ストロベリーパウダー／乳化剤（大豆由来）、香料、酸味料、着色料（紅麹、アカビート）,,１枚（標準５．５ｇ）,32,0.3,2.1,2.9,0,,無,70,148,36,
4.90333E+12,111,ロッテ　ポリフェノールショコラ　ミルク５６ｇ,220,20190903,6,12,１２ヶ月,12,56,266,452,349,6580,砂糖、カカオマス、全粉乳、ココアバター、植物油脂／ヘスペリジン、乳化剤（大豆由来）、香料,,１枚（標準４ｇ）,22,0.3,1.3,2.3,0,,無,106,106,40,
4.90333E+12,111,＄ロッテ　クランキーストロベリー１枚,110,20190219,10,12,１２ヶ月,12,45,175,379,308,7490,植物油脂、乳糖、砂糖、ココアバター、全粉乳、小麦粉、ホエイパウダー、でん粉、乾燥苺、クリームパウダー、ストロベリーパウダー、モルトエキス、食塩／乳化剤（大豆由来）、トレハロース、着色料（アカビート、カラメル）、香料、膨脹剤,,１枚（標準４５ｇ）,258,1.4,16.3,26.4,0,,無,70,159,11,
4.90333E+12,111,ロッテ　リルフィーカ　４８ｇ,230,20200128,10,8,１２ヶ月,12,56,238,573,459,7940,ココアバター、砂糖、全粉乳、乳糖、植物油脂、カカオマス、紅茶パウダー、ココアパウダー、粉末酒、バターオイル／乳化剤（大豆由来）、香料,,１粒（標準４．１ｇ）,30,0.1,0,11.8,0,,無,109,108,54,
4.90333E+12,111,ロッテ　とろっと柑橘リキュールのチョコ　１０粒,200,20210323,10,9,６ヶ月,6,58,188,438,294,7300,砂糖（国内製造）、植物油脂、カカオマス、全粉乳、ココアバター、乳糖、酒精、濃縮温州みかん果汁、ホエイパウダー、柑橘リキュール、濃縮グレープフルーツ果汁／ソルビトール、トレハロース、グリセリン、乳化剤（大豆由来）、香料、酸味料、クチナシ色素,,１粒（標準５．７ｇ）,31,0.22,1.9,3.1,0,,無,90,138,16,
4.90333E+12,111,＄ロッテ　クランキーベイクドチーズタルト　１枚,110,20181120,10,12,１２ヶ月,12,45,175,379,308,7490,植物油脂、乳糖、砂糖、ココアバター、全粉乳、小麦粉、クッキークランチ（小麦粉、ショートニング、砂糖、その他）、ホエイパウダー、チーズパウダー、でん粉、クリームパウダー、モルトエキス、食塩／乳化剤（大豆由来）、トレハロース、膨脹剤、香料、着色料（クチナシ、カラメル）,,１枚（標準４５ｇ）,257,2.2,16.2,25.6,0,,無,70,159,11,
4.90333E+12,111,ロッテ　ガーナ　ピンクチョコレート４５ｇ,140,20210105,10,12,１２ヶ月,12,45,175,379,308,7490,全粉乳、ココアバター、砂糖、植物油脂、乳糖、ストロベリーパウダー／乳化剤（大豆由来）、香料、アカビート色素、酸化防止剤（ビタミンＥ、ヤマモモ抽出物）,,１箱　（４５ｇ）,277,3.7,20.5,19.4,0,,無,70,159,11,
4.90333E+12,111,ロッテ　ガーナムース　ミルクの休息５８ｇ,240,20190312,6,12,９ヶ月,9,59,309,528,311,7520,砂糖、ココアバター、全粉乳、カカオマス、植物油脂、生クリーム（北海道産１００％）、洋酒／乳化剤（大豆由来）、酒精、香料、カラメル色素,,１粒　（標準７．３５ｇ）,44,0.4,3.2,3.3,0,,無,97,122,48,
4.90333E+12,111,ロッテ　シャルロッテフルーツティー　９粒,280,20200107,10,8,８ヶ月,8,80,276,378,328,8890,砂糖、紅茶ソース（砂糖、果糖、麦芽糖、ストロベリー果肉、レモン果皮ペースト、濃縮ブルーベリー果汁、濃縮レモン果汁、濃縮ストロベリー果汁、紅茶エキスパウダー、紅茶パウダー）、カカオマス、全粉乳、植物油脂、ココアバター、生クリーム、乳糖、乳等を主要原料とする食品、洋酒／ソルビトール、グリセリン、乳化剤（大豆由来）、酒精、増粘剤（増粘多糖類、加工でん粉）、酸味料、香料,,１粒（標準８．９ｇ）,44,0.4,2.5,5.1,0,,無,88,154,25,
4.90333E+12,111,＄ロッテ　クランキー爽バニラ１枚,110,20190514,10,12,１２ヶ月,12,45,175,379,308,7490,植物油脂、乳糖、砂糖、エリスリトール、ココアバター、小麦粉、全粉乳、ホエイパウダー、でん粉、クリームパウダー、モルトエキス、食塩／トレハロース、乳化剤（大豆由来）、香料、膨脹剤、着色料（クチナシ、カラメル）,,１枚　（標準４５ｇ）,241,1.3,15.3,27.6,0,,無,70,159,11,
4.90333E+12,111,ロッテ　チェリーブランデー　２本,200,20200107,10,8,８ヶ月,8,90,284,282,170,8620,砂糖、全粉乳、カカオマス、植物油脂、チェリーゼリーソース（果糖、砂糖、濃縮チェリー果汁、水あめ、洋酒）、ココアバター、生クリーム、乳糖、濃縮チェリー果汁、乳等を主要原料とする食品（卵を含む）、洋酒／ソルビトール、酒精、乳化剤（大豆由来）、酸味料、増粘剤（ペクチン、寒天）、香料、乳酸Ｃａ、ベニコウジ色素,,１本（標準４４ｇ）,230,2.4,14.2,22.7,0,,無,75,132,12,
4.90333E+12,111,ロッテ　ポリフェノールショコラ　カカオ７０％５６ｇ,220,20190903,6,12,１２ヶ月,12,56,266,452,349,6580,カカオマス、砂糖、ココアバター、ココアパウダー、植物油脂／ヘスペリジン、香料（乳由来）、乳化剤（大豆由来）,,１枚（標準４ｇ）,24,0.4,1.7,1.8,0,,無,106,106,40,
4.90333E+12,111,ロッテ　乳酸菌ショコラグラノラメープル＆アーモンド,160,20191015,10,6,９ヶ月,9,35,276,451,211,2920,砂糖、グラノラ（砂糖、米パフ、小麦粉、アーモンド、植物油脂、オーツ麦、メープルシュガー、食塩）、カカオマス、全粉乳、ココアバター、植物油脂、アーモンドペースト、乳酸菌末、水あめ／増粘剤（アラビアガム）、乳化剤、光沢剤、香料、酸化防止剤（ビタミンＥ）、（一部に乳成分・小麦・大豆・ゼラチンを含む）,,１袋（３４ｇ）,174,2.2,9.5,21.3,0,,無,130,115,35,
4.90333E+12,111,＄ロッテ　シャルロッテストロベリージュレ　９粒,280,20181002,10,8,８ヶ月,8,80,276,378,328,8890,砂糖、ストロベリーソース（砂糖、水あめ、濃縮ストロベリー果汁、洋酒、濃縮パッションフルーツ果汁）、カカオマス、全粉乳、植物油脂、生クリーム、ココアバター、乳糖、洋酒／ソルビトール、グリセリン、トレハロース、酸味料、乳化剤（大豆由来）、酒精、香料、増粘剤（寒天、ペクチン）、着色料（紅麹、アントシアニン）,,１粒（標準８．９ｇ）,44,0.4,2.5,5,0,,無,88,154,25,
4.90333E+12,111,＄ロッテ　アーモンドチョコクッキーソルト８１ｇ,250,20200609,10,8,９ヶ月,9,82,198,438,333,9170,砂糖、アーモンド、全粉乳、ココアバター、カカオマス、ココアクッキークランチ（小麦粉、砂糖、ショートニング、ココアパウダー、デキストリン、ぶどう糖果糖液糖、カカオマス、ホエイパウダー、食塩）、植物油脂、乳糖、食塩、水あめ　／　乳化剤（大豆由来）、光沢剤、増粘剤（アラビアガム）、香料、膨脹剤,,１箱（８１ｇ）,458,8,29.4,40.2,0,,無,90,155,20,
4.90333E+12,111,＄ロッテ　紗々　琥珀安納芋６９ｇ,220,20180904,10,8,１２ヶ月,12,70,274,384,338,8900,砂糖、カカオマス、全粉乳、乳糖、植物油脂、ココアバター、さつまいもパウダー（安納芋１００％）　／　乳化剤（大豆由来）、香料、着色料（カラメル、クチナシ、アナトー）,　乳成分・大豆,１枚（標準４．４ｇ）,25,0.3,1.5,2.5,0,,無,86,160,25,
4.90333E+12,111,＄ロッテ　紗々　曙いちご６９ｇ,220,20191126,10,8,１２ヶ月,12,70,274,384,338,8900,砂糖、カカオマス、全粉乳、乳糖、植物油脂、ココアバター、苺パウダー　／　乳化剤（大豆由来）、香料、酸味料、パプリカ色素,,１枚（標準４．４ｇ）,25,0.3,1.5,2.5,0,,無,86,160,25,
4.90333E+12,111,＄ロッテ　生ガーナとろ～りミルク６４ｇ,250,20191008,6,12,７ヶ月,7,64,309,528,311,7900,砂糖、ココアバター、全粉乳、カカオマス、生クリーム（北海道産１００％）、植物油脂、エリスリトール、洋酒／ソルビトール、トレハロース、乳化剤（大豆由来）、酒精、香料,,１粒（標準８．０ｇ）,41,0.5,2.8,3.8,0,,無,97,122,48,
4.90333E+12,111,＄ロッテ　ガーナフィアンティーヌトリュフ４９ｇ,200,20200908,8,10,１２ヶ月,12,50,290,475,272,6400,砂糖、全粉乳、カカオマス、フィアンティーヌ（小麦粉、砂糖、果糖ぶどう糖液糖、ショートニング、バター、脱脂粉乳、モルトエキス、食塩）、植物油脂、ココアバター、ココアパウダー、クリームパウダー／乳化剤（大豆由来）、香料,,１箱　（４９ｇ）,270,3.3,15.8,28.4,0,,無,88,124,33,
4.90333E+12,111,ロッテ　シャルロッテ　生チョコレートカカオ１２枚,280,20201006,6,12,８ヶ月,8,68,242,450,320,8030,カカオマス、砂糖、生クリーム、植物油脂、ココアバター、乳等を主要原料とする食品（卵を含む）、洋酒、全粉乳、ヘーゼルナッツペースト／ソルビトール、乳化剤（大豆由来）、香料,,１枚　（標準５．７ｇ）,31,0.3,2.1,2.7,0,,無,70,148,36,
4.90333E+12,111,ロッテ　クランキー　ほうじ茶ラテ１枚,110,20200714,10,12,１２ヶ月,12,45,175,379,308,7490,植物油脂、乳糖、砂糖、小麦粉、ココアバター、全粉乳、ホエイパウダー、でん粉、ほうじ茶パウダー、クリームパウダー、モルトエキス、食塩／トレハロース、乳化剤（大豆由来）、膨脹剤、着色料（パプリカ色素、カラメル）、香料,,１枚（標準４５ｇ）,257,1.8,16.2,26.1,0,,無,70,159,11,
4.90333E+12,111,＄ロッテ　ガーナムース　春の香味５８ｇ,240,20190312,6,12,９ヶ月,9,59,309,528,311,7520,砂糖、ココアバター、全粉乳、植物油脂、カカオマス、乳糖、濃縮ストロベリー果汁、さくらリキュール／乳化剤（大豆由来）、酒精、香料、酸味料、クチナシ色素、酸化防止剤（ビタミンＥ、ヤマモモ抽出物）,,１粒　（標準７．３５ｇ）,44,0.4,3.2,3.4,0,,無,97,122,48,
4.90333E+12,111,ロッテ　乳酸菌ショコラグラノラモバイルパウチ３４ｇ,160,20180904,10,6,９ヶ月,9,35,276,451,211,4800,砂糖、グラノラ（小麦粉、砂糖、麦芽糖、ライスパフ、粒状大豆たんぱく、オーツ麦、アーモンド、植物油脂、食塩）、カカオマス、全粉乳、ココアバター、植物油脂、乳酸菌末、水あめ／乳化剤、光沢剤、香料、増粘剤（アラビアガム）、酸化防止剤（ビタミンＥ）、（一部に乳成分・小麦・大豆・ゼラチンを含む）,,１袋（３４ｇ）,174,2.9,9.3,20.7,0,,無,130,115,35,
4.90333E+12,111,＄ロッテ　ガーナ生クリーム仕立て９粒,200,20200407,10,8,１２ヶ月,12,77,276,378,328,8730,砂糖、全粉乳、カカオマス、植物油脂、ココアバター、乳糖、生クリーム／乳化剤（大豆由来）、香料,,１粒（標準８．６ｇ）,49,0.7,3,4.7,0,,無,88,154,25,
4.90333E+12,111,ロッテ　ガーナベリーの生チョコレート　６４ｇ,250,20201006,6,12,７ヶ月,7,64,309,528,311,7900,砂糖、ココアバター、全粉乳、カカオマス、生クリーム、植物油脂、濃縮ストロベリー果汁、乳糖、洋酒、濃縮ラズベリー果汁／ソルビトール、トレハロース、グリセリン、酒精、乳化剤（大豆由来）、香料、酸味料、クチナシ色素、酸化防止剤（ビタミンＥ、ヤマモモ抽出物）,,１粒（標準８．０ｇ）,43,0.4,2.8,3.9,0,,無,97,122,48,
4.90333E+12,111,ロッテ　紗々　紅赤いちご６９ｇ,220,20201124,10,8,１２ヶ月,12,70,274,384,338,8900,砂糖、カカオマス、全粉乳、乳糖、植物油脂、ココアバター、苺果汁パウダー　／　乳化剤（大豆由来）、香料、酸味料、ベニコウジ色素,,１枚（標準４．４ｇ）,25,0.3,1.5,2.5,0,,無,86,160,25,
4.90333E+12,111,＄ロッテ　シャルロッテジュレストロベリー９粒,280,20191001,10,8,８ヶ月,8,80,276,378,328,8890,砂糖、ストロベリーソース（砂糖、果糖、ストロベリー果肉、麦芽糖、濃縮ストロベリー果汁、濃縮パッションフルーツ果汁）、カカオマス、全粉乳、植物油脂、ココアバター、生クリーム、乳糖、乳等を主要原料とする食品、洋酒、濃縮フランボワーズ果汁加工品／ソルビトール、グリセリン、酸味料、乳化剤（大豆由来）、酒精、増粘剤（増粘多糖類、加工でん粉）、着色料（アントシアニン、紅麹、紅花黄）、香料,,１粒（標準８．９ｇ）,44,0.4,2.5,5,0,,無,88,154,25,
4.90333E+12,111,ロッテ　シャルロッテ　生チョコキャラメル１２枚,280,20201006,6,12,８ヶ月,8,68,242,450,320,8030,砂糖、ココアバター、植物油脂、全粉乳、生クリーム、カカオマス、乳糖、キャラメルペースト、脱脂粉乳、乳等を主要原料とする食品（卵を含む）、濃縮パッションフルーツ果汁、洋酒、食塩（ロレーヌ産岩塩１００％）／ソルビトール、酒精、乳化剤（大豆由来）、カラメル色素、香料,,１枚　（標準５．７ｇ）,32,0.3,2.3,2.6,0,,無,70,148,36,
4.90333E+12,111,ロッテ　アーモンドチョコレート　ソルティ７２ｇ,250,20190611,10,8,９ヶ月,9,72,198,438,333,8390,アーモンド加工品（アーモンド、砂糖、水あめ、植物油脂、はっ酵調味料）、砂糖、全粉乳、ココアバター、カカオマス、植物油脂、乳糖、食塩（ロレーヌ産岩塩１００％）　／　光沢剤、乳化剤（大豆由来）、香料,,１箱（７２ｇ）,410,7.7,26.1,35.9,0,,無,90,155,20,
4.90333E+12,111,ロッテ　シャルロッテ　生チョコレートカカオ１２枚,280,20191001,6,12,８ヶ月,8,68,242,450,320,8030,カカオマス、砂糖、生クリーム、植物油脂、ココアバター、乳等を主要原料とする食品、洋酒、全粉乳／ソルビトール、乳化剤（大豆由来）、香料,,１枚　（標準５．７ｇ）,31,0.3,2.1,2.7,0,,無,70,148,36,
4.90333E+12,111,ロッテ　シャルロッテ　生チョコストロベリー１２枚,280,20210119,6,12,８ヶ月,8,68,242,450,320,8030,砂糖、カカオマス、ココアバター、植物油脂、生クリーム、乳糖、全粉乳、乳等を主要原料とする食品（卵を含む）、濃縮ストロベリー果汁、脱脂粉乳、洋酒、濃縮カシス果汁、濃縮パッションフルーツ果汁／ソルビトール、酒精、乳化剤（大豆由来）、香料、クチナシ色素、酸味料,,１枚　（標準５．７ｇ）,32,0.2,2.3,2.7,0,,無,70,148,36,
4.90333E+12,111,＄ロッテガーナマリアージュブルーベリー　６４ｇ,250,20200407,6,12,１２ヶ月,12,66,242,450,320,7850,砂糖、カカオマス、ココアバター、乳糖、植物油脂、全粉乳、脱脂粉乳、ブルーベリー果汁加工品、ブルーベリーパウダー／乳化剤（大豆由来）、香料、着色料（アカビート、クチナシ、アントシアニン）、酸味料,,１枚（標準５．５ｇ）,32,0.3,2.2,2.9,0,,無,70,148,36,
4.90333E+12,111,＄ロッテ　ホイップガーナ京抹茶５８ｇ,240,20200310,6,12,９ヶ月,9,59,309,530,311,7520,砂糖、ココアバター、全粉乳、植物油脂、カカオマス、乳糖、乳等を主要原料とする食品（卵を含む）、還元水あめ、洋酒、抹茶／乳化剤（大豆由来）、酒精、香料、着色料（フラボノイド、クチナシ）、酸化防止剤（ビタミンＥ、ヤマモモ抽出物）,,１粒　（標準７．３５ｇ）,44,0.4,3.2,3.4,0,,無,97,122,48,
4.90333E+12,111,＄ロッテ乳酸菌ショコラグラノラ３種のナッツモバイル,160,20190709,10,6,９ヶ月,9,35,276,451,211,2920,砂糖、グラノラ（砂糖、米パフ、小麦粉、アーモンド、植物油脂、大豆、オーツ麦、ヘーゼルナッツペースト、マカダミアナッツ、食塩）、カカオマス、全粉乳、ココアバター、植物油脂、アーモンドペースト、乳酸菌末、水あめ／増粘剤（アラビアガム）、乳化剤、光沢剤、香料、酸化防止剤（ビタミンＥ）、（一部に乳成分・小麦・大豆・ゼラチンを含む）,,１袋（３４ｇ）,175,2.4,9.7,20.9,0,,無,130,115,35,
4.90333E+12,111,＄ロッテ　ガーナムース爽やかカカオ　５８ｇ,240,20180703,6,12,９ヶ月,9,59,309,528,311,7520,砂糖、カカオマス、植物油脂、ココアバター、全粉乳、還元水あめ、洋酒、濃縮ライム果汁、カカオエキス／乳化剤（大豆由来）、香料,,１粒（標準７．３５ｇ）,44,0.4,3.2,3.4,0,,無,97,122,48,
4.90333E+12,111,ロッテ　とろっといちごリキュールのチョコ　１０粒,200,20210323,10,9,６ヶ月,6,58,188,438,294,7300,砂糖（国内製造）、植物油脂、カカオマス、全粉乳、ココアバター、乳糖、酒精、濃縮ラズベリー果汁、ホエイパウダー、濃縮いちご果汁、いちごリキュール／ソルビトール、トレハロース、グリセリン、乳化剤（大豆由来）、酸味料、香料、着色料（クチナシ、カラメル）,,１粒（標準５．７ｇ）,31,0.23,1.9,3.1,0,,無,90,138,16,
4.90333E+12,111,＄ロッテ　シャルロッテ生チョコレート　１２枚,280,20181002,6,12,８ヶ月,8,68,242,450,320,8030,カカオマス、砂糖、生クリーム（北海道産１００％）、植物油脂、ココアバター、乳等を主要原料とする食品、洋酒、全粉乳／ソルビトール、乳化剤（大豆由来）、香料,,１枚　（標準５．７ｇ）,31,0.3,2.1,2.8,0,,無,70,148,36,
4.90333E+12,111,ロッテ　シャルロッテ　生チョコレートバニラ１２枚,280,20191001,6,12,８ヶ月,8,68,242,450,320,8030,砂糖、ココアバター、植物油脂、全粉乳、生クリーム、カカオマス、乳糖、脱脂粉乳、乳等を主要原料とする食品、洋酒／ソルビトール、乳化剤（大豆由来）、酒精、香料、クチナシ色素,,１枚　（標準５．７ｇ）,33,0.3,2.4,2.6,0,,無,70,148,36,
4.90333E+12,111,＄ロッテ　ガーナトリュフ白プラリネ　４６ｇ,200,20190115,8,10,９ヶ月,9,46,272,475,266,6060,全粉乳、砂糖、ココアバター、植物油脂、乳糖、ヘーゼルナッツプラリネペースト、ヘーゼルナッツペースト、でん粉　／　乳化剤（大豆由来）、香料、酸化防止剤（ビタミンＥ、ヤマモモ抽出物）,,１箱　（４６ｇ）,42,0,0,16.6,0,,無,88,124,30,
4.90333E+12,111,＄ロッテ　ストロベリーリキュール　１２粒,200,20181106,10,8,６ヶ月,6,69,181,326,262,7400,砂糖、全粉乳、植物油脂、カカオマス、ココアバター、水あめ、乳糖、ストロベリーリキュール、濃縮ストロベリー果汁加工品、酒精、濃縮ラズベリー果汁加工品／乳化剤（大豆由来）、香料、着色料（アントシアニン、紅花黄）、酸味料,,１粒（標準５．７ｇ）,29,0.3,1.5,3.2,0,,無,75,122,16,
4.90333E+12,111,＄ロッテ　シャルロッテ生チョコラムミルク１２枚,280,20191217,6,12,８ヶ月,8,68,242,450,320,8030,砂糖、ココアバター、植物油脂、全粉乳、生クリーム、カカオマス、乳糖、洋酒、脱脂粉乳、乳等を主要原料とする食品／ソルビトール、乳化剤（大豆由来）、カラメル色素、香料,,１枚　（標準５．７ｇ）,32,0.3,2.4,2.6,0,,無,70,148,36,
4.90333E+12,111,＄ロッテ　クランキーつぶつぶ苺＆シリアル　１枚,110,20180828,10,12,１２ヶ月,12,45,175,379,308,7490,植物油脂、乳糖、砂糖、ココアバター、全粉乳、小麦粉、ホエイパウダー、コーンフレーク、苺加工品、でん粉、クリームパウダー、モルトエキス、食塩／乳化剤（大豆由来）、トレハロース、増粘多糖類、膨脹剤、酸味料、香料、カラメル色素,,１枚（標準４５ｇ）,255,1.5,15.7,26.9,0,,無,70,159,11,
4.90333E+12,111,＄ロッテクランキーはちみつレモン　１枚,110,20200421,10,12,１２ヶ月,12,45,175,379,308,7490,植物油脂、乳糖、砂糖、小麦粉、ココアバター、全粉乳、ホエイパウダー、はちみつレモンパウダー、でん粉、クリームパウダー、レモン果汁パウダー、モルトエキス、食塩／トレハロース、乳化剤（大豆由来）、香料、膨脹剤、着色料（クチナシ、カラメル）,,１枚　（標準４５ｇ）,255,1.5,15.6,27,0,,無,70,159,11,
4.90333E+12,111,ロッテ　ガーナミルクの生チョコレート　６４ｇ,250,20201006,6,12,７ヶ月,7,64,309,528,311,7900,砂糖、ココアバター、全粉乳、生クリーム、カカオマス、植物油脂、乳糖、洋酒（はちみつリキュール、ラム酒）／ソルビトール、トレハロース、グリセリン、乳化剤（大豆由来）、酒精、香料、酸味料、酸化防止剤（ビタミンＥ、ヤマモモ抽出物）,,１粒（標準８．０ｇ）,44,0.4,3,3.8,0,,無,97,122,48,
4.90333E+12,111,＄ロッテ　ガーナトリュフプラリネショコラ　４６ｇ,200,20180911,8,10,９ヶ月,9,47,266,475,272,6000,砂糖、全粉乳、カカオマス、ココアバター、ヘーゼルナッツプラリネペースト（ヘーゼルナッツ、砂糖）、植物油脂、ヘーゼルナッツペースト、ミルククラム、ココアパウダー、アーモンドペースト、乳糖、食塩、香辛料／乳化剤（大豆由来）、香料,乳成分・大豆,１箱　（４６ｇ）,261,4.2,16.6,23.8,0,,無,88,124,30,
4.90333E+12,111,＄ロッテ　クランキーとうもろこし１枚,110,20190820,10,12,１２ヶ月,12,45,175,379,308,7490,植物油脂、乳糖、砂糖、小麦粉、ココアバター、全粉乳、とうもろこしパウダー（北海道産とうもろこし１００％）、ホエイパウダー、でん粉、クリームパウダー、モルトエキス、食塩／トレハロース、乳化剤（大豆由来）、膨脹剤、香料、カラメル色素,,１枚　（標準４５ｇ）,255,2,15.7,26.4,0,,無,70,159,11,
4.90333E+12,111,＄ロッテ　紗々　黒蜜きなこ６９ｇ,220,20180612,10,8,１２ヶ月,12,70,274,384,338,8900,砂糖、カカオマス、全粉乳、乳糖、植物油脂、ココアバター、きな粉（大豆を含む）、黒蜜パウダー／　乳化剤、香料、着色料（カラメル、紅麹）,,１枚（標準４．４ｇ）,25,0.3,1.5,2.5,0,,無,86,160,25,
4.90333E+12,111,＄ロッテポリフェノールショコラカカオ７０％　５６ｇ,220,20190903,6,12,１２ヶ月,12,56,266,452,349,6580,カカオマス、砂糖、ココアバター、ココアパウダー、植物油脂／ヘスペリジン、香料、乳化剤（大豆由来）,大豆,１枚（標準４ｇ）,24,0.4,1.7,1.8,0,,無,106,106,40,
4.90333E+12,111,ロッテ　乳酸菌ショコラグラノラ　いちごパウチ３４ｇ,160,20190205,10,6,９ヶ月,9,35,276,451,211,2920,砂糖、グラノラ（砂糖、米パフ、小麦粉、玄米パフ、オーツ麦、植物油脂、アーモンド、ストロベリーパウダー）、カカオマス、全粉乳、ココアバター、植物油脂、乳酸菌末、水あめ／増粘剤（アラビアガム）、乳化剤、光沢剤、酸味料、香料、酸化防止剤（ビタミンＥ）、（一部に乳成分・小麦・大豆・ゼラチンを含む）,,１袋（３４ｇ）,173,2.2,9.2,21.6,0,,無,130,115,35,
4.90333E+12,111,＄ロッテシャルロッテ　生チョコフランボワーズ１２枚,280,20181204,6,12,８ヶ月,8,68,242,450,320,8030,砂糖、ココアバター、植物油脂、全粉乳、カカオマス、生クリーム、乳糖、濃縮フランボワーズ果汁、脱脂粉乳、乳等を主要原料とする食品、洋酒、濃縮ライチ果汁、大豆胚芽エキス／ソルビトール、乳化剤、酒精、香料、クチナシ色素、酸味料,,１枚　（標準５．７ｇ）,32,0.3,2.3,2.6,0,,無,70,148,36,
