49777734,133,＄ロッテ　Ｓウォーズタブカードケースライトサイド,100,20151208,10,12,４５０日,15,8,163,256,178,2510,イチョウ葉抽出物、甘味料（ソルビトール、アスパルテーム・Ｌ－フェニルアラニン化合物）、香料、乳化剤、微粒酸化ケイ素,,１パック　７ｇあたり,21,0.04,0.06,6.8,0,,無,53,78,8,
49778120,133,＄ロッテ　Ｓウォーズタブフォースミント　３２ｇ,210,20150630,10,12,３６０日,12,33,177,404,265,6280,還元麦芽糖水あめ、食物繊維、香料、増粘剤（アラビアガム）、乳化剤、酸味料、甘味料（アセスルファムＫ、スクラロース）、着色料（クチナシ、紅花黄）、光沢剤、ビタミンＢ6、ニコチン酸アミド、（原材料の一部にゼラチンを含む）,ゼラチン,1パック（32ｇ）あたり,67,0,0.4,31,0,,無,30,122,30,
49778281,133,ロッテ　ＡＣＵＯタブレット　ＩＣＥＳＰＡＲＫ５０粒,100,20150331,10,12,３６０日,12,8,163,256,178,2510,還元パラチノース、ルブス抽出物、甘味料(ソルビトール、アスパルテーム・L-フェニルアラニン化合物)、香料、微粒酸化ケイ素、乳化剤、着色料(カカオ、クチナシ、カラメル),,1パック(7g),21,0.04,0.04,6.7,0,,無,53,78,8,
49778489,133,ロッテ　ブラックタブレットストロング　３２ｇ,200,20180731,10,12,１２ヶ月,12,33,177,404,265,6280,マルチトール、パラチノース、イチョウ葉抽出物、菊花抽出物／香料、加工でん粉、増粘剤（アラビアガム）、着色料（カカオ、クチナシ、カラメル）、乳化剤、カフェイン、甘味料（アセスルファムＫ、スクラロース）、光沢剤、（一部にゼラチンを含む）,ゼラチン,１パック（３２ｇ）,90,0.2,0.5,30.6,0,,無,30,122,30,
49778502,133,＄ロッテ　ＡＣＵＯタブレットＥＸＴＲＡ　ＣＯＯＬ,100,20151110,10,12,４５０日,15,8,158,256,178,2490,ルブス抽出物、甘味料（ソルビトール、アスパルテーム・Ｌ－フェニルアラニン化合物）、香料、乳化剤、微粒酸化ケイ素,,１パック　７ｇあたり,21,0,0.04,6.8,0.4,,無,53,78,8,
49778618,133,＄ロッテ　グラマティックタブレット月夜ベリー５０ｇ,100,20160315,10,12,１２ヶ月,12,8,158,256,178,2490,甘味料（ソルビトール、アスパルテーム・Ｌ－フェニルアラニン化合物）、乳化剤、酸味料、微粒酸化ケイ素、香料,,１パック（７ｇ）,22,0.04,0.2,6.7,0.4,,無,53,78,8,
49778939,133,＄ロッテ　目から鼻に抜けるタブレット　２３ｇ,200,20170124,10,12,１２ヶ月,12,33,177,404,265,6280,還元麦芽糖水あめ、食物繊維、じゃばらエキス、香料、乳化剤、微粒酸化ケイ素、甘味料（アセスルファムＫ、スクラロース）,,,0,0,0,0,0,,無,30,122,30,
49778960,133,ロッテ　ＡＣＵＯタブレットＣＬＥＡＲＳＴＲＥＡＭ,100,20150331,10,12,３６０日,12,8,163,256,178,2510,還元パラチノース、ルブス抽出物、甘味料(ソルビトール、アスパルテーム・L-フェニルアラニン化合物)、香料、乳化剤、微粒酸化ケイ素、クチナシ色素,,1パック(7g),21,0.04,0.04,6.8,0,,無,50,78,8,
49779868,133,＄ロッテ　Ｓウォーズタブカードケースダークサイド,115,20150630,10,12,３６０日,12,8,163,256,178,2510,還元パラチノース、甘味料（ソルビトール、アスパルテーム・Ｌ-フェニルアラニン化合物）、香料、乳化剤、微粒化ケイ素、野菜色素,なし,50粒（7ｇ）あたり,21,0.04,0.07,6.8,0,,無,53,78,8,
4.90333E+12,133,＄ロッテ　ＧＲＥＥＮダカラタブレット　２４ｇ,140,20150526,10,6,３６０日,12,25,170,581,405,2950,砂糖、レモン果汁パウダー、グレープフルーツ果汁パウダー、はちみつパウダー、食塩、水あめ、ドライトマトエキス、海藻エキス、乳化剤、グレープフルーツ香料、酸味料,なし,１粒（標準2.5ｇ）あたり,10,0,0.04,2.4,10,,無,160,110,35,
4.90333E+12,133,＄ロッテ　小梅ラムネ　２４ｇ,120,20170207,10,8,１２ヶ月,12,24,314,295,211,2800,砂糖、水あめ、梅果汁パウダー、酸味料、乳化剤、重曹、香料、野菜色素,,,0,0,0,0,0,,無,150,100,14,
4.90333E+12,133,＄ロッテ　デカビタＣタブレット　２４ｇ,120,20170516,10,8,１２ヶ月,12,24,314,295,211,2800,還元麦芽糖水あめ、ローヤルゼリーエキスパウダー／酸味料、重曹、乳化剤、甘味料（アスパルテーム・Ｌ－フェニルアラニン化合物）、微粒酸化ケイ素、紅花色素、ビタミンＣ、ナイアシン、香料、増粘剤（グァーガム）、パントテン酸Ｃａ、ビタミンＢ２、ビタミンＢ６、ビタミンＢ１、ビタミンＢ１２,,１パック（２４ｇ）,58,0.2,1,20.8,0,,無,150,100,14,
4.90333E+12,133,＄ロッテ　グラマティックタブ月夜のベリー大粒タイプ,100,20151020,10,8,３６０日,12,25,320,298,214,2850,甘味料（ソルビトール、アスパルテーム・L-フェニルアラニン化合物）、乳化剤、酸味料、微粒酸化ケイ素、香料,なし,1袋（24g）あたり,75,0.1,0.6,22.7,1,,無,150,100,14,
4.90333E+12,133,＄ロッテ　Ｃ．Ｃ．レモンタブレット　２４ｇ,120,20160628,10,8,１２ヶ月,12,24,314,295,211,2800,還元麦芽糖水あめ、レモン果汁パウダー、乳化剤、酸味料、重曹、甘味料（アスパルテーム・Ｌ－フェニルアラニン化合物）、ビタミンＣ、微粒酸化ケイ素、香料、紅花色素、増粘剤（グァーガム）,,,0,0,0,0,0,,無,150,100,14,
4.90333E+12,133,＄ロッテ　小梅　恋ラムネ２４ｇ,120,20180213,10,8,１２ヶ月,12,24,314,295,211,2800,＜ぶどう味＞砂糖、水あめ／酸味料、乳化剤、重曹、香料、着色料（野菜色素、クチナシ）＜梅味＞砂糖、水あめ、梅果汁パウダー／酸味料、乳化剤、重曹、野菜色素、香料,,,0,0,0,0,0,,無,150,100,14,
4.90333E+12,133,＄ロッテ　スースーしないのど飴タブレット　３０ｇ,200,20161115,10,8,１２ヶ月,12,34,304,354,211,3350,還元麦芽糖水あめ、食物繊維、はちみつパウダー、カリンエキスパウダー、ハーブエキスパウダー、乳化剤、香料、酸味料、着色料（紅花黄、カラメル）、甘味料（アセスルファムＫ、スクラロース）,,,0,0,0,0,0,,無,150,100,15,
4.90333E+12,133,＄ロッテ　グリーンＤＡＫＡＲＡタブレット　４８ｇ,260,20160531,6,6,１２ヶ月,12,50,205,529,411,3060,砂糖、食塩、水あめ、グレープフルーツ果汁パウダー、レモン果汁パウダー、濃縮シークワーサー果汁、濃縮みかん果汁、ドライトマトエキス、乳化剤、グレープフルーツ香料、酸味料,,１粒（標準２．５ｇ）,10,0,0.04,2.4,10,,無,195,130,45,
4.90333E+12,133,＄ロッテ　小梅とキティ恋する乙女のラムネ　２４ｇ,120,20170711,10,8,１２ヶ月,12,24,314,295,211,2800,＜梅味＞砂糖、水あめ、梅果汁パウダー／酸味料、乳化剤、重曹、香料、野菜色素＜りんご味＞砂糖、水あめ／酸味料、乳化剤、重曹、紅花色素、香料,,,0,0,0,0,0,,無,150,100,14,
4.90333E+12,133,＄ロッテ　ＧＲＥＥＮ　ＤＡ・ＫＡ・ＲＡ　タブレット,140,20170328,10,6,１２ヶ月,12,25,170,581,405,2950,砂糖、食塩、水あめ、グレープフルーツ果汁パウダー、レモン果汁パウダー、濃縮シークワーサー果汁、濃縮みかん果汁、ドライトマトエキス／乳化剤、酸味料、グレープフルーツ香料,,１粒（標準２．５ｇ）,10,0,0.04,2.4,0,,無,160,110,35,
4.90333E+12,133,ロッテ　キシリトールタブレット　３０ｇ,200,20180522,10,8,１２ヶ月,12,34,304,354,211,3350,＜グレープ＞食物繊維／甘味料（キシリトール）、乳化剤、リン酸一水素カルシウム、着色料（クチナシ、野菜色素）、香料、フクロノリ抽出物＜イチゴ＞食物繊維／甘味料（キシリトール）、乳化剤、リン酸一水素カルシウム、香料、野菜色素、フクロノリ抽出物,,,0,0,0,0,0,,無,150,100,15,
4.90333E+12,133,ロッテ　ＥＡＴＭＩＮＴ　クリアブルーミント１８ｇ,150,20200331,10,12,１２ヶ月,12,19,143,466,288,4360,マルチトール、還元水あめ、植物油脂、ゼラチン、食物繊維、大豆たんぱく／増粘剤（アラビアガム、ＣＭＣ）、香料、乳化剤、セルロース、甘味料（アセスルファムＫ、スクラロース）、光沢剤、クチナシ色素、酸化防止剤（ビタミンＥ）、キシリトール,,,0,0,0,0,0,,無,130,90,11,
4.90333E+12,133,ロッテ　ＥＡＴＭＩＮＴピーチミント　１８ｇ,150,20200804,10,12,１２ヶ月,12,19,143,466,288,4360,マルチトール、還元水あめ、植物油脂、ゼラチン、食物繊維／増粘剤（アラビアガム、ＣＭＣ）、乳化剤（大豆由来）、香料、セルロース、甘味料（アセスルファムＫ、スクラロース）、光沢剤、着色料（野菜色素、紅花色素）、酸化防止剤（ビタミンＥ）,,,0,0,0,0,0,,無,130,90,11,
4.90333E+12,133,＄ロッテ　とけるキシリトール３０ｇ,200,20190521,10,8,１２ヶ月,12,34,304,354,211,3370,食物繊維／甘味料（キシリトール）、加工でん粉、乳化剤、リン酸一水素カルシウム、香料、フクロノリ抽出物,,１袋（３０ｇ）,95,0,0.8,28.9,0,,無,150,100,15,
4.90333E+12,133,＄ロッテ　デカビタＣタブレット　２４ｇ,120,20180313,10,8,１２ヶ月,12,24,314,295,211,2800,マルチトール、ローヤルゼリーエキスパウダー／酸味料、重曹、乳化剤、甘味料（アスパルテーム・Ｌ－フェニルアラニン化合物）、微粒酸化ケイ素、紅花色素、ビタミンＣ、ナイアシン、香料、増粘剤（グァーガム）、パントテン酸Ｃａ、ビタミンＢ２、ビタミンＢ６、ビタミンＢ１、ビタミンＢ１２,,１パック（２４ｇ）,59,0.3,1.1,20.9,0,,無,150,100,14,
4.90333E+12,133,＄ロッテ　小彩塩タブレットレモン　２４ｇ,140,20180515,10,6,１２ヶ月,12,25,170,581,405,3270,砂糖、エリスリトール、食塩、水あめ／乳化剤、酸味料、紅花色素、香料、ビタミンＣ,,１粒（標準２．５ｇ）,9,0,0.1,2.3,0,,無,160,110,35,
4.90333E+12,133,ロッテ　マイニチケア　おやすみタブレット１３ｇ,180,20200915,10,12,１２ヶ月,12,13,143,466,288,2930,食物繊維／甘味料（キシリトール）、Ｌ―テアニン、乳化剤、加工でん粉、香料、ヘスペリジン,,３粒（３．３ｇ）,11,0.3,0.14,2.9,0,,無,130,90,11,
4.90333E+12,133,＄ロッテＣ．Ｃ．レモンタブレット　２４ｇ,120,20190618,10,8,１２ヶ月,12,25,314,295,211,2840,マルチトール、レモン果汁パウダー／酸味料、重曹、乳化剤、ビタミンＣ、甘味料（アスパルテーム・Ｌ－フェニルアラニン化合物）、微粒酸化ケイ素、紅花色素、香料、増粘剤（グァーガム）,,１パック（２４ｇ）,59,0.2,1.2,21.2,0,,無,150,100,14,
4.90333E+12,133,ロッテ　マイニチケア　血圧が高めの方のタブレット,150,20200303,10,12,１２ヶ月,12,23,143,466,288,3770,甘味料（ソルビトール、アセスルファムＫ、スクラロース）、乳化剤、微粒酸化ケイ素、ヘスペリジン、香料,,４粒（４ｇ）,12,0,0.1,3.8,0,,無,130,90,11,
4.90333E+12,133,＄ロッテ　マイニチケアタブレット１９ｇ,150,20190903,10,12,９ヶ月,9,19,143,466,288,3770,マルチトール、食物繊維、ＧＡＢＡ／乳化剤、酸味料、増粘剤（アラビアガム）、着色料（カラメル、カカオ、クチナシ）、香料、甘味料（アセスルファムＫ、スクラロース）、光沢剤,,３粒（３．８４ｇ）,8,0.03,0.05,3.7,0,,無,130,90,11,
4.90333E+12,133,ロッテ　キシリトールラムネグレープ　１２ｇ,100,20200407,10,12,１２ヶ月,12,13,254,289,237,2440,食物繊維／甘味料（キシリトール、アスパルテーム・Ｌ－フェニルアラニン化合物、アセスルファムＫ）、加工でん粉、乳化剤、香料、着色料（クチナシ、野菜色素）、リン酸一水素カルシウム、フクロノリ抽出物,,１袋（１２ｇ）,38,0,0.3,11.5,0,,無,120,90,15,
4.90333E+12,133,＄ロッテデカビタＣダブルタブレット　２４ｇ,120,20190319,10,8,１２ヶ月,12,24,314,295,211,2800,マルチトール、ローヤルゼリーエキスパウダー／酸味料、重曹、乳化剤、甘味料（アスパルテーム・Ｌ－フェニルアラニン化合物）、微粒酸化ケイ素、紅花色素、ビタミンＣ、ナイアシン、香料、増粘剤（グァーガム）、パントテン酸Ｃａ、ビタミンＢ２、ビタミンＢ６、ビタミンＢ１、ビタミンＢ１２,,１パック（２４ｇ）,59,0.3,1.1,20.8,0,,無,150,100,14,
4.90333E+12,133,ロッテ　マイニチケアタブ　ストレスや疲労感を軽減,150,20201103,10,12,１２ヶ月,12,19,143,466,288,3770,マルチトール、食物繊維、ＧＡＢＡ／乳化剤、酸味料、増粘剤（アラビアガム）、着色料（カラメル、カカオ、クチナシ）、香料、甘味料（アセスルファムＫ、スクラロース）、光沢剤、（一部にゼラチンを含む）,ゼラチン,３粒（３．８４ｇ）,8,0.03,0.06,3.7,0,,無,130,90,11,
4.90333E+12,133,＄ロッテ　塩小梅タブレット梅＆レモン袋４８ｇ,200,20200512,10,1,１２ヶ月,12,50,143,277,187,750,＜梅味＞砂糖、エリスリトール、食塩、でん粉、水あめ、梅果汁パウダー、還元パラチノース／乳化剤、グルコン酸Ｋ、酸味料、香料、野菜色素、ビタミンＣ、甘味料（スクラロース）＜レモン味＞砂糖、エリスリトール、食塩、でん粉、水あめ、還元パラチノース／乳化剤、グルコン酸Ｋ、酸味料、紅花色素、香料、ビタミンＣ、甘味料（スクラロース）,,,0,0,0,0,0,,無,185,140,20,
4.90333E+12,133,ロッテ　キシリトールやわらかタブシトラス　２０ｇ,150,20200407,10,18,１２ヶ月,12,21,277,457,288,5460,食物繊維／甘味料（キシリトール、アセスルファムＫ）、加工でん粉、乳化剤、紅花色素、香料、リン酸一水素カルシウム、フクロノリ抽出物,,１袋（２０ｇ）,63,0,0.5,19.2,0,,無,130,90,15,
4.90333E+12,133,ロッテ　ＥＡＴＭＩＮＴ　シトラスミント１８ｇ,150,20200331,10,12,１２ヶ月,12,19,143,466,288,4360,マルチトール、還元水あめ、植物油脂、ゼラチン、食物繊維、大豆たんぱく／増粘剤（アラビアガム、ＣＭＣ）、乳化剤、香料、セルロース、甘味料（アセスルファムＫ、スクラロース）、光沢剤、着色料（紅花黄、野菜色素）、酸化防止剤（ビタミンＥ）、キシリトール,,,0,0,0,0,0,,無,130,90,11,
4.90333E+12,133,＄ロッテＤＡ・ＫＡ・ＲＡタブレット　２４ｇ,120,20200512,10,8,１２ヶ月,12,25,314,295,211,2840,砂糖、食塩、水あめ、マスカット果汁パウダー、グレープフルーツ果汁パウダー、濃縮シークワーサー果汁、レモン果汁パウダー、濃縮みかん果汁、ドライトマトエキス／乳化剤、酸味料、グルコン酸Ｋ、香料、ピロリン酸鉄,,１袋（２４ｇ）,97,0,0.7,22.8,0,,無,150,100,14,
4.90333E+12,133,ロッテ　キシリトールラムネ　３２ｇ,200,20210316,10,8,１２ヶ月,12,34,304,345,211,3540,＜ソーダ＞食物繊維（アメリカ製造）／甘味料（キシリトール、アスパルテーム・Ｌ－フェニルアラニン化合物、アセスルファムＫ）、加工でん粉、乳化剤、リン酸一水素カルシウム、クチナシ色素、フクロノリ抽出物、香料＜ぶどう＞食物繊維（アメリカ製造）／甘味料（キシリトール、アスパルテーム・Ｌ－フェニルアラニン化合物、アセスルファムＫ）、加工でん粉、乳化剤、香料、着色料（クチナシ、野菜色素）、リン酸一水素カルシウム、フクロノリ抽出物＜りんご＞食物繊維（アメリカ製造）／甘味料（キシリトール、アスパルテーム・Ｌ－フェニルアラニン化合物、アセスルファムＫ）、加工でん粉、乳化剤、リン酸一水素カルシウム、香料、フクロノリ抽出物、野菜色素,,,0,0,0,0,0,,無,150,100,15,
45205026,134,ロッテ　だいすき！ピカチュウグミ　２８ｇ,80,20201006,16,6,１２ヶ月,12,31,173,442,190,3610,水あめ、砂糖、ゼラチン、濃縮グレープ果汁、オブラートパウダー／ソルビトール、酸味料、ゲル化剤（ペクチン：りんご由来）、香料、着色料（ブラックキャロットジュース、クチナシ）、光沢剤,,１袋（２８ｇ）,90,1.5,0,21.5,0,,無,98,98,15,
49777451,134,＄ロッテ　ポケモングミ　５７ｇ,100,20160517,10,8,９ヶ月,9,59,173,530,208,5600,,ゼラチン,,0,0,0,0,0,,無,135,98,15,
49778700,134,＄ロッテ　トーマスソーダグミ　２８ｇ,80,20180306,16,6,９ヶ月,9,31,173,442,190,3610,水あめ、砂糖、ゼラチン、オブラートパウダー／ソルビトール、酸味料、ゲル化剤（ペクチン）、香料、クチナシ色素、乳化剤、光沢剤,ゼラチン,１袋（２８ｇ）,89,1.9,0,21,0,,無,98,98,15,
4.90333E+12,134,＄ロッテ　かじって果実グミ　ＧＦ３４ｇ,100,20150630,10,8,２７０日,9,36,300,318,224,3790,水あめ、砂糖、ゼラチン、グレープフルーツピューレ、オブラートパウダー、植物油脂、コラーゲンペプチド、ソルビトール、セルロース、酸味料、香料、乳化剤、紅花色素、光沢剤,,,0,0,0,0,0,,無,145,105,14,
4.90333E+12,134,＄ロッテ　かじって果実グミ　甘熟いちご３４ｇ,100,20141202,10,8,２７０日,9,36,300,318,224,3730,,,,0,0,0,0,0,,無,145,105,14,
4.90333E+12,134,＄ロッテ　オランジーナグミ７２ｇ,180,20170523,10,8,１２ヶ月,12,75,317,496,187,7000,水あめ、砂糖、ゼラチン、オブラートパウダー、濃縮オレンジ果汁、濃縮グレープフルーツ果汁、濃縮レモン果汁、オレンジピールエキス、ソルビトール、酸味料、香料、ゲル化剤（ペクチン）、乳化剤、着色料（紅花黄、パプリカ色素）、光沢剤,,１袋（７２ｇ）,233,4.2,0,55.4,0,,無,155,120,15,
4.90333E+12,134,＄ロッテ　小梅ちゃん梅干グミ　はちみつ仕立て３４ｇ,100,20151103,10,8,３６０日,12,36,317,308,224,3740,水あめ、砂糖、ゼラチン、梅ペースト、はちみつ、濃縮梅果汁、オブラートパウダー、植物油脂、ソルビトール、酸味料、香料、ゲル化剤（ペクチン）、アントシアニン色素、乳化剤、光沢剤,ゼラチン,１袋　３４ｇあたり,112,1.9,0,26.5,16,,無,145,105,14,
4.90333E+12,134,ロッテ　かじって果実グミ　マンゴー３４ｇ,100,20150630,10,8,３６０日,12,36,300,318,224,3790,水あめ、砂糖、マンゴーピューレ（アルフォンソ種100％）、ゼラチン、オブラートパウダー、植物油脂、コラーゲンペプチド、ソルビトール、セルロース、酸味料、香料、乳化剤、着色料（紅花黄、カロチノイド）、光沢剤,ゼラチン,1袋（34ｇ）あたり,109,1.8,0,0,0,,無,145,105,14,
4.90333E+12,134,＄ロッテ　かじって果実グミ　ぶどう３４ｇ,100,20140527,10,8,２７０日,9,0,0,0,0,0,,,,0,0,0,0,0,,無,0,0,0,?
4.90333E+12,134,＄ロッテ　小梅ときどき檸檬ぐみ　３４ｇ,100,20150324,10,12,３６０日,12,36,300,337,272,5530,水あめ、砂糖、ゼラチン、梅ペースト、濃縮梅果汁、オブラートパウダー、植物油脂、梅エキス、ソルビトール、酸味料、乳酸Ca、ゲル化剤(ペクチン)、香料、アントシアニン色素、乳化剤、甘味料(アセスルファムK、スクラロース)、他,ゼラチン,,0,0,0,0,0,,無,145,105,14,
4.90333E+12,134,＄ロッテ　小梅グミ　３４ｇ,100,20170321,10,8,１２ヶ月,12,39,317,308,224,3750,水あめ、砂糖、ゼラチン、梅ペースト、濃縮梅果汁（和歌山県産南高梅１００％）、オブラートパウダー、植物油脂、梅エキス／ソルビトール、酸味料、ゲル化剤（ペクチン）、乳化剤、アントシアニン色素、香料、光沢剤,ゼラチン,１袋（３４ｇ）,111,1.9,0,26.3,0,,無,150,105,14,
4.90333E+12,134,＄ロッテ　かじって果実グミ　マンゴー３４ｇ,100,20131004,10,8,２７０日,9,36,300,318,224,3730,,,,0,0,0,0,0,,無,145,105,14,
4.90333E+12,134,＄ロッテ　グラマティックグミ華やぐマスカット４８ｇ,100,20151020,10,8,２７０日,9,50,307,318,224,5090,水あめ、砂糖、ゼラチン、濃縮マスカット果汁、オブラートパウダー、植物油脂、コラーゲンペプチド、ソルビトール、酸味料、酸味料、香料、ゲル化剤（ペクチン）、着色料（紅花黄、クチナシ）、乳化剤、光沢剤,ゼラチン,１袋（48ｇ）あたり,155,2.6,0,37.1,4,,無,150,105,14,
4.90333E+12,134,＄ロッテ　ハートいっぱい小梅ちゃんぐみ　４０ｇ,100,20140930,10,8,２７０日,9,0,0,0,0,0,,,,0,0,0,0,0,,無,0,0,0,?
4.90333E+12,134,＄ロッテ　Ｃ．Ｃ．レモングミ　８５ｇ,180,20170523,10,8,１２ヶ月,12,92,327,526,210,8290,水あめ、砂糖、ゼラチン、オブラートパウダー、濃縮レモン果汁／ソルビトール、酸味料、ビタミンＣ、ゲル化剤（ペクチン）、香料、乳化剤、紅花色素、光沢剤,ゼラチン,１袋（８５ｇ）,275,4.9,0,65.4,0,,無,160,125,15,
4.90333E+12,134,ロッテ　Ｆｉｔ’ｓグミグレープ４２ｇ,120,20180925,10,8,９ヶ月,9,47,310,318,224,4560,水あめ、砂糖、ゼラチン、濃縮ぶどう果汁、オブラートパウダー／ソルビトール、酸味料、増粘多糖類、香料、着色料（野菜色素、クチナシ、紅花黄）、乳化剤、タンニン、光沢剤,ゼラチン,１袋（４２ｇ）,135,2.2,0.2,32.1,0,,無,150,105,14,
4.90333E+12,134,＄ロッテ　スイカ＆メロンバーグミ７３ｇ,180,20190709,10,8,９ヶ月,9,75,347,506,210,8000,＜スイカバー味＞水あめ、砂糖、ゼラチン、濃縮スイカ果汁、オブラートパウダー／ソルビトール、酸味料、ゲル化剤（ペクチン）、香料、乳化剤、着色料（野菜色素、クチナシ、紅花黄）、光沢剤＜メロンバー味＞水あめ、砂糖、ゼラチン、濃縮メロン果汁、オブラートパウダー／ソルビトール、酸味料、ゲル化剤（ペクチン）、香料、乳化剤、着色料（クチナシ、紅花黄）、光沢剤,ゼラチン,,0,0,0,0,0,,無,170,120,15,
4.90333E+12,134,＄ロッテ　スイカ＆メロンバーグミ７３ｇ,180,20200630,10,8,９ヶ月,9,75,347,506,210,8000,＜スイカバー味＞水あめ、砂糖、ゼラチン、濃縮スイカ果汁、オブラートパウダー／ソルビトール、酸味料、ゲル化剤（ペクチン）、香料、乳化剤、着色料（野菜色素、クチナシ、紅花黄）、光沢剤＜メロンバー味＞水あめ、砂糖、ゼラチン、濃縮メロン果汁、オブラートパウダー／ソルビトール、酸味料、ゲル化剤（ペクチン）、香料、乳化剤、着色料（クチナシ、紅花黄）、光沢剤,ゼラチン,,0,0,0,0,0,,無,170,120,15,
4.90333E+12,134,ロッテ　Ｆｉｔ’ｓグミ　グレープ＆ピーチ１０２ｇ,200,20200901,10,8,９ヶ月,9,105,357,506,235,9670,＜グレープ味＞水あめ、砂糖、ゼラチン、濃縮グレープ果汁、オブラートパウダー／ソルビトール、酸味料、グリセリン、乳酸Ｃａ、増粘剤（プルラン）、香料、着色料（野菜色素、クチナシ）、甘味料（アセスルファムＫ、スクラロース）、乳化剤、光沢剤＜ピーチ味＞水あめ、砂糖、ゼラチン、濃縮ピーチ果汁、オブラートパウダー／ソルビトール、酸味料、グリセリン、増粘多糖類、香料、乳化剤、野菜色素、光沢剤,,,0,0,0,0,0,,無,170,120,23,
4.90333E+12,134,ロッテ　Ｆｉｔ’ｓグミ　みかん＆いちご　１０２ｇ,200,20210209,10,8,９ヶ月,9,105,357,506,235,9670,＜みかん味＞水あめ、砂糖、ゼラチン、濃縮みかん果汁（温州みかん１００％）、オブラートパウダー、オレンジピールエキス／ソルビトール、酸味料、グリセリン、乳酸Ｃａ、増粘剤（プルラン）、香料、甘味料（アセスルファムＫ、スクラロース）、乳化剤、着色料（紅花黄、パプリカ色素）、光沢剤＜いちご味＞水あめ、砂糖、ゼラチン、濃縮いちご果汁、オブラートパウダー／ソルビトール、酸味料、グリセリン、増粘多糖類、香料、着色料（野菜色素、紅花黄）、乳化剤、光沢剤,,,0,0,0,0,0,,無,170,120,23,
