4.90411E+12,423,中村屋　スパイスカリーキーマ＆トマトツナ,350,20180412,5,8,１８ヶ月,18,200,268,360,273,8000,【キーマカリー】ココナッツミルク、鶏肉、野菜ソテーペースト（玉ねぎ、キャベツ、にんじん、白菜、大豆もやし、アスパラガス、ブロッコリー、大豆油、セロリ）、ソテーオニオン、レンズ豆、なたね油、乾燥オニオン、香辛料、ココナッツ、野菜（しょうが、にんにく）、食塩、チキンエキス、砂糖／増粘剤（加工でん粉）、（一部に乳成分・鶏肉・大豆を含む） 【ツナカリー】トマトピューレー、ソテーオニオン、ツナ、ココナッツミルクパウダー、なたね油、野菜（しょうが、にんにく）、香辛料、トマトケチャップ、レンズ豆、食塩、かつお節粉末、香味油、酵母エキス／香辛料抽出物、（一部に乳成分を含む）,乳、大豆、鶏肉,1食分（100ｇ）当たり,171,4.8,11.7,11.5,0,,無,170,130,25,
4.90411E+12,423,中村屋　インドカリーベジタブル　２１０ｇ,330,20170213,5,8,１８ヶ月,18,210,268,360,273,8400,野菜（じゃがいも、にんじん、いんげん、しょうが、にんにく）、揚げカボチャ、炒め野菜（玉ねぎ、にんじん、ラード）、ソテーオニオン、トマト･ピューレーづけ、トマトピューレー、ココナッツミルクパウダー、ひよこ豆、食用油脂（オリーブ油、からし油、なたね油）、砂糖、香辛料、カレー粉、レンズ豆、チキンエキス、カシューナッツパウダー、チキンブイヨン、トマトペースト、食塩、酵母エキス、バター、香味油／増粘剤（加工でん粉）、調味料（アミノ酸等）、着色料（パプリカ色素）、香辛料抽出物、塩化Ｃａ、（一部に乳成分・小麦・カシューナッツ・大豆・鶏肉を含む）,乳、小麦、カシューナッツ、大豆、鶏肉,1食分（２１０ｇ）当たり,212,3.8,10.1,26.5,0,,無,170,130,25,
4.90411E+12,423,中村屋　インドカリーベジタブル　２１０ｇ×２袋,0,20171214,10,2,５４０日,18,420,380,270,240,8400,野菜(じゃがいも、にんじん、いんげん、しょうが、にんにく)、揚げカボチャ、炒め野菜(玉ねぎ、にんじん、ラード)、ソテーオニオン、トマト・ピューレーづけ、トマトピューレー、ココナッツミルクパウダー、ひよこ豆、食用油脂(オリーブ油、からし油、なたね油)、砂糖、香辛料、カレー粉、レンズ豆、チキンエキス、カシューナッツパウダー、チキンブイヨン、トマトペースト、食塩、酵母エキス、バター、香味油/増粘剤(加工でん粉)、調味料(アミノ酸等)、着色料(パプリカ色素)、香辛料抽出物、塩化Ca、(一部に乳性分・小麦・カシューナッツ・大豆・鶏肉を含む),卵、小麦、カシューナッツ、大豆、鶏肉,表示単位（当り）１食（２１０ｇ）,212,3.8,10.1,26.5,0,,無,170,130,40,
4.90411E+12,423,中村屋　プレミアムインドカリー　スパイシーチキン,430,20170814,5,8,５４０日,18,200,288,360,273,8000,ローストチキン（鶏手羽もと、でん粉、その他）、鶏肉、ソテーオニオン、炒め野菜（玉ねぎ、バター、にんじん、しょうが、にんにく）、発酵乳（殺菌）、ひよこ豆ペースト、なたね油、チキンエキス、カレー粉、バター、レンズ豆、カシューナッツパウダー、食塩、野菜（しょうが、にんにく）、酵母エキス、砂糖、香辛料／増粘剤（加工でん粉）、酸味料、ｐH調整剤、香辛料抽出物、（一部に卵・乳成分・小麦・カシューナッツ・大豆・鶏肉を含む）,卵、乳、小麦、カシューナッツ、大豆、鶏肉,１食分（２００ｇ）当たり,330,16.8,22.6,14.8,0,増粘剤（加工でん粉）、酸味料他,無,170,130,27,
4.90411E+12,423,中村屋　プレミアムインドカリーバターチキン２００ｇ,430,20170814,5,8,５４０日,18,200,288,360,273,8000,ローストチキン（鶏手羽もと、でん粉、その他）、鶏肉、トマトピューレー、ソテーオニオン、クリーム、トマトペースト、カシューナッツペースト、バター、ヨーグルト、香辛料、ココナッツミルクパウダー、チキンエキス、小麦粉、野菜（しょうが、にんにく）、カレー粉、食塩、ラード、砂糖、酵母エキス／トレハロース、増粘剤（加工でん粉）、パプリカ色素、ｐH調整剤、（一部に卵・乳成分・小麦・カシューナッツ・大豆・鶏肉を含む）,卵、乳、小麦、カシューナッツ、大豆、鶏肉,１食分（２００ｇ）当たり,340,16.2,23.4,16.2,0,トレハロース、増粘剤（加工でん粉）他,無,170,130,27,
4.90411E+12,423,中村屋　ビーフハヤシ　たっぷり牛肉と濃厚デミグラス,330,20170814,5,8,５４０日,18,200,268,360,273,8000,野菜（玉ねぎ、にんにく）、牛肉、デミグラスソース、発酵調味料、トマトケチャップ、小麦粉、食用油脂（牛脂、ラード）、砂糖、ビーフエキス、ブイヨン、ウスターソース、甘味果実酒、香味食用油、食塩、ローストオニオン、バター、赤ワイン、香辛料／増粘剤（加工でん粉）、着色料（カラメル）、調味料（アミノ酸等）、（一部に乳成分・小麦・牛肉・大豆・鶏肉・豚肉・りんご・ゼラチンを含む）,乳、小麦、牛肉、大豆、鶏肉、豚肉、りんご、ゼラチン,１食分（２００ｇ）当たり,321,9,23,19.6,0,増粘剤（加工でん粉）他,無,170,130,27,
4.90411E+12,423,中村屋　インドカリービーフスパイシー　２００ｇ,330,20090309,5,8,１８ヶ月,18,0,0,0,0,0,,,,0,0,0,0,0,,無,0,0,0,?
4.90411E+12,423,＄中村屋　インドカリーベジタブル　２００ｇ,330,20090309,5,8,１８ヶ月,18,0,0,0,0,0,,,,0,0,0,0,0,,無,0,0,0,?
4.90411E+12,423,中村屋　インドカリービーフスパイシー　２００ｇ×２,0,20161107,10,2,１８ヶ月,18,400,380,270,240,8000,真空調理ビーフ（牛肉、砂糖、その他）、ソテーオニオン、野菜・果実（じゃがいも、りんご、しょうが、にんにく）、炒め野菜（玉ねぎ、にんじん、ラード）、カレー粉、トマトピューレー、食用油脂（なたね油、大豆油、ラード）、ヨーグルト、トマトペースト、ビーフエキス、ココナッツミルクパウダー、小麦粉、砂糖、チキンエキス、ポークブイヨン、食塩、ウスターソース、バターオイル、バター、香辛料、増粘剤（加工でん粉）、着色料（カラメル）、調味料（アミノ酸等）、香辛料抽出物、（原材料の一部に卵を含む）,卵、乳、小麦、牛肉、大豆,１食（２００ｇ）,265,6.6,17.2,21,986,,無,170,130,40,
4.90411E+12,423,中村屋　インドカリースパイシーチキン　２００ｇ×２,0,20161107,10,2,１８ヶ月,18,400,380,270,240,8000,ソテーオニオン、鶏肉、野菜（じゃがいも、しょうが、にんにく）、食用油脂（ラード、大豆油）、カレー粉、炒め野菜（玉ねぎ、にんじん、ラード）、酵母エキス、チキンエキス、ヨーグルト、小麦粉、オニオンエキス、合成清酒、バターオイル、チキンブイヨン、食塩、バター、ローストオニオン、香辛料、でん粉、増粘剤（加工でん粉）、調味料（アミノ酸等）、着色料（カラメル）、香辛料抽出物、（原材料の一部に豚肉を含む）,卵、乳、小麦、大豆、鶏肉、豚肉,１食（２００ｇ）,210,3.8,10.4,25.2,674,,無,170,130,40,
4.90411E+12,423,中村屋　インドカリーベジタブル　２００ｇ×２,0,20161107,10,2,１８ヶ月,18,400,380,270,240,8000,野菜（じゃがいも、にんじん、いんげん、しょうが、にんにく）、揚げカボチャ、炒め野菜（玉ねぎ、にんじん、ラード）、ソテーオニオン、トマト・ピューレ漬け、トマトピューレ、食用油脂（からし油、オリーブ油、ラード）、ココナッツミルクパウダー、ひよこ豆、砂糖、カレー粉、香辛料、レンズ豆、チキンエキス、カシューナッツパウダー、チキンブイヨン、トマトペースト、食塩、酵母エキス、バター、香味油、増粘剤（加工でん粉）、調味料（アミノ酸等）、パプリカ色素、香辛料抽出物、塩化Ｃａ、（原材料の一部に小麦大豆を含む）,卵、乳、小麦、大豆,,210,3.8,10.4,25.2,674,,無,170,130,40,
4.90411E+12,423,＄中村屋　インドカリー濃厚バターチキン　１８０ｇ,330,20140814,5,8,５４０日,18,0,0,0,0,0,,,,0,0,0,0,0,,無,0,0,0,?
4.90411E+12,423,中村屋　インドカリー濃厚マイルドチキン　１８０ｇ,330,20150817,5,8,５４０日,18,180,268,360,273,7200,鶏肉、ソテーオニオン、野菜（じゃがいも、しょうが、にんにく）、食用油脂（なたね油、ラード）、ヨーグルト、クリーム、カシューナッツペースト、トマトペースト、カレー粉、砂糖、チキンエキス、トマトケチャップ、マーガリン、香辛料、小麦粉　他,乳、小麦、カシューナッツ、牛肉、大豆、鶏肉、豚肉,１８０ｇあたり,292,10.1,19.1,20,864,増粘剤、甘味料、調味料,無,170,130,25,
4.90411E+12,423,中村屋　技あり仕込みビーフカリー濃厚リッチ１８０ｇ,251,20150817,5,8,３６０日,12,180,271,360,273,7200,野菜・果実（玉ねぎ、じゃがいも、りんご、しょうが）、牛肉、食用油脂（なたね油、牛脂）、カレールウ、ビーフエキス、砂糖、デーツピューレ、たん白加水分解物、香辛料、加糖練乳、脱脂粉乳、チキンエキス、オニオンパウダー、トマトペースト、マーガリン、　他,乳、小麦、牛肉、大豆、鶏肉、豚肉、りんご,１８０ｇあたり,236,5.8,13.5,22.7,770,着色料、増粘剤、調味料,無,170,130,25,
4.90411E+12,423,中村屋　技あり仕込みビーフカリースパイシーリッチ,251,20150817,5,8,３６０日,12,180,271,360,273,7200,野菜・果実（玉ねぎ、じゃがいも、りんご、にんにく）、牛肉、なたね油、カレールウ、ビーフエキス、デーツピューレ、加糖練乳、砂糖、カレー粉、たん白加水分解物、オニオンパウダー、香辛料、チキンエキス、トマトペースト他,乳、小麦、牛肉、大豆、鶏肉、豚肉、りんご,１８０ｇあたり,238,5.8,13.7,22.9,846,増粘剤、着色料、調味料,無,170,130,25,
4.90411E+12,423,中村屋　技あり仕込みビーフカリー中辛　１８０ｇ,251,20150817,5,8,３６０日,12,180,271,360,273,7200,野菜・果実（玉ねぎ、じゃがいも、りんご、しょうが）、牛肉、カレールウ、食用油脂（なたね油、牛脂）、ビーフエキス、デーツピューレ、砂糖、たん白加水分解物、オニオンパウダー、加糖練乳、脱脂粉乳、チキンエキス、トマトペースト、マーガリン、　他,乳、小麦、牛肉、大豆、鶏肉、豚肉、りんご,１８０ｇあたり,220,5.6,12.8,20.5,821,増粘剤、調味料、着色料,無,170,130,25,
4.90411E+12,423,＄中村屋純欧風ビーフカリーコク深いデミの芳醇リッチ,430,20160216,5,8,５４０日,18,180,268,360,273,7200,真空調理ビーフ（牛肉、赤ワイン、その他）、ソテーオニオン（玉ねぎ、にんじん、ラード、その他）、マッシュルーム、デミグラスソース、トマトケチャップ、食用油脂（なたね油、牛脂、ラード）、デーツピューレ、ローストオニオン、カレー粉、砂糖、小麦粉、クリーム（乳製品）、ビーフエキス、ブイヨン、香辛料、食塩、赤ワイン、にんにく、フォンドボー、着色料（カラメル）、増粘剤（加工でん粉）、調味料（アミノ酸等）、ｐＨ調整剤、（原材料の一部に卵、大豆、鶏肉、豚肉、りんご、ゼラチンを含む）,卵、乳、小麦、牛肉、大豆、鶏肉、豚肉、りんご、ゼラチン,１食分（１８０ｇ）当たり,300,8.8,21.1,18.7,920,着色料（カラメル）他,無,170,130,25,
4.90411E+12,423,＄中村屋純欧風ビーフカリーキノコが香る濃厚マイルド,430,20160215,5,8,５４０日,18,180,268,360,273,7200,真空調理ビーフ（牛肉、赤ワイン、その他）、ソテーオニオン（玉ねぎ、にんじん、ラード、その他）、マッシュルーム、クリーム（乳製品）、ソースベース（ホールトマト、玉ねぎ、大豆油、にんじん、その他）、食用油脂（牛脂、なたね油、大豆油）、デーツピューレ、水飴、小麦粉、ビーフエキス、きのこペースト、野菜・果実（りんご、しょうが、にんにく）、カレー粉、砂糖、食塩、香辛料、バターオイル、ローストオニオン、増粘剤（加工でん粉）、着色料（カラメル）、調味料（アミノ酸等）、ｐＨ調整剤、（原材料の一部に卵、鶏肉、豚肉,卵、乳、牛肉、大豆、鶏肉、豚肉、りんご,１食分（１８０ｇ）当たり,321,8.8,24.7,15.8,850,増粘剤（加工でん粉）他,無,170,130,25,
4.90411E+12,423,中村屋　純欧風ビーフカリー濃厚リッチ　１８０ｇ,430,20160815,5,8,５４０日,18,180,268,360,273,7200,真空調理ビーフ（牛肉、赤ワイン、その他）、ソテーオニオン（玉ねぎ、にんじん、ラード、その他）、マッシュルーム、クリーム、ソースベース（ホールトマト、玉ねぎ、大豆油、にんじん、その他）、デーツピューレ、小麦粉、水飴、食用油脂（牛脂、なたね油、ラード）、ビーフエキス、きのこペースト、野菜・果実（りんご、しょうが、にんにく）、カレー粉、砂糖、食塩、香辛料、バター、ローストオニオン、増粘剤（加工でん粉）、調味料（アミノ酸等）、着色料（カラメル）、ｐＨ調整剤、（原材料の一部に卵、鶏肉、豚肉を含む）,卵、乳、小麦、牛肉、大豆、鶏肉、豚肉、りんご,1食分(180g)当り,311,8.8,23.4,16.4,850,,無,170,130,25,
4.90411E+12,423,中村屋　純欧風ビーフカリー　あいがけ９０ｇ×２,430,20170213,5,8,１８ヶ月,18,400,380,270,240,8000,芳醇リッチ：真空調理ビーフ（牛肉、赤ワイン、その他）、ソテーオニオン（玉ねぎ、にんじん、ラード、その他）、マッシュルーム、デミグラスソース、トマトケチャップ、食用油脂（なたね油、牛脂、ラード）、デーツピューレ、ローストオニオン、カレー粉、砂糖、小麦粉、クリーム（乳製品）、ビーフエキス、ブイヨン、香辛料、食塩、赤ワイン、にんにく、フォンドボー、着色料（カラメル）、増粘剤（加工でん粉）、調味料（アミノ酸等）、ｐＨ調整剤、（原材料の一部に卵、大豆、鶏肉、豚肉、りんご、ゼラチンを含む） 真空調理ビーフ（牛肉、赤ワイン、その他）、ソテーオニオン（玉ねぎ、にんじん、ラード、その他）、マッシュルーム、クリーム、ソースベース（ホールトマト、玉ねぎ、大豆油、にんじん、その他）、デーツピューレ、小麦粉、水飴、食用油脂（牛脂、なたね油、ラード）、ビーフエキス、きのこペースト、野菜・果実（りんご、しょうが、にんにく）、カレー粉、砂糖、食塩、香辛料、バター、ローストオニオン、増粘剤（加工でん粉）、調味料（アミノ酸等）、着色料（カラメル）、ｐＨ調整剤、（原材料の一部に卵、鶏肉、豚肉を含む）,卵、乳、小麦、牛肉、大豆、鶏肉、豚肉,１食（１８０ｇ）,275,7,18.7,19.6,918,,無,170,130,40,
4.90411E+12,429,中村屋　こだわり仕立濃厚クリームシチュー　２１０ｇ,330,20160815,5,8,３６０日,12,210,268,360,273,8400,鶏肉、乳等を主要原料とする食品、野菜（じゃがいも、にんじん）、油脂加工食品、マッシュルーム、デキストリン、ソテーオニオン（玉ねぎ、大豆油、バターオイル）、マーガリン、クリーム、チーズ、チキンエキス、小麦粉、ガラスープ、ラード、香味油、食塩、卵白粉末、香辛料、トレハロース、増粘剤（加工でん粉）、調味料（無機塩等）、甘味料（ソルビット）、加工でん粉、香料、ｐH調整剤、（原材料の一部に牛肉、豚肉を含む）,卵、乳、小麦、牛肉、大豆、鶏肉、豚肉,1食分(210g)当り,315,10.9,19.3,24.4,630,,無,170,130,25,
4.90411E+12,429,中村屋　濃厚ビーフシチュー　厚切り牛肉２００ｇ,396,20170814,5,8,５４０日,18,200,268,360,273,8000,牛肉加工品（牛肉、赤ワイン、その他）、野菜（じゃがいも、にんにく）、デミグラスソース、マッシュルーム、水飴、発酵調味料、砂糖、ビーフエキス、ローストオニオン、たん白加水分解物、オニオンパウダー、ポークブイヨン、大豆油、赤ワイン、バターオイル、食塩、香辛料／増粘剤（加工でん粉、タマリンド）、着色料（カラメル）、調味料（アミノ酸等）、ｐＨ調整剤、（一部に卵・乳成分・小麦・牛肉・大豆・鶏肉・豚肉・りんご・ゼラチンを含む）,卵、乳、小麦、牛肉、大豆、鶏肉、豚肉、りんご、ゼラチン,１食分（２００ｇ）当たり,260,8.2,13.2,27,0,増粘剤（加工でん粉、タマリンド）他,無,170,130,25,
4.90411E+12,445,＄中村屋　インドカリーチキンイエローマサラ　９０ｇ,250,20140901,24,2,３年,36,0,0,0,0,0,,,,0,0,0,0,0,,無,0,0,0,?
4.90411E+12,445,＄中村屋　インドカリーチキングリーンマサラ　９０ｇ,250,20140901,24,2,３年,36,0,0,0,0,0,,,,0,0,0,0,0,,無,0,0,0,?
4.90411E+12,445,＄中村屋　インドカリーチキンレッドマサラ　９０ｇ,250,20140901,24,2,３年,36,0,0,0,0,0,,,,0,0,0,0,0,,無,0,0,0,?
4.90411E+12,445,＄中村屋インドカリーチキン鶏肉とじゃがいもの煮込み,250,20150306,24,2,３年,36,90,317,172,239,4320,鶏肉、野菜(じゃがいも、カリフラワー、しょうが、にんにく)、ソテーオニオン、煮豆(金時豆)、トマトピューレー、香辛料、ココナッツミルクパウダー、砂糖、食塩、なたね油、チキンエキス、しょうゆ、増粘剤(加工デンプン)、加工デンプン、他,乳、小麦、大豆、鶏肉,1食分(90g)あたり,124,7.6,5.9,10.1,413,増粘剤、加工デンプン、調味料、塩化Ca、他,無,77,74,34,
4.90411E+12,541,中村屋　本格四川鮮烈な辛さ、しびれる麻婆豆腐　,220,20180412,5,8,１８ヶ月,18,150,218,360,273,6000,＜ソース＞食肉（豚肉、鶏肉、牛肉）、食用油脂（なたね油、ラード）、豆板醤、しょうゆ、香辛料、粒状植物性たん白、砂糖、魚醤、ヤラピノピューレ、ビーフエキス、たん白加水分解物、発酵調味料、ポークブイヨン、香味油、マー油／増粘剤（加工でん粉）、調味料（アミノ酸等）、着色料（カラメル、パプリカ色素、クチナシ、紅麹、カカオ）、（一部に乳成分・小麦・牛肉・大豆・鶏肉・豚肉を含む） ＜別添スパイス＞さんしょう,乳、小麦、牛肉、大豆、鶏肉、豚肉,1人分（50ｇ）当たり,102,4,8,3.5,0,,無,170,130,20,
4.90411E+12,541,中村屋　辛さ、ほとばしる麻婆丼,240,20180412,5,8,１８ヶ月,18,160,268,360,273,6400,＜ソース＞豆腐、食肉（鶏肉、豚肉、牛肉）、食用油脂（なたね油、ラード、ごま油）、豆板醤、ビーフエキス、粒状植物性たん白、砂糖、しょうゆ、豆、発酵調味料、マー油、ポークブイヨン、香辛料／増粘剤（加工でん粉、増粘多糖類）、調味料（アミノ酸等）、着色料（カラメル、パプリカ色素、クチナシ、カカオ、紅麹）、凝固剤、（一部に乳成分・小麦・牛肉・ごま・大豆・鶏肉・豚肉を含む） ＜別添スパイス＞さんしょう,乳、小麦、牛肉、ごま、大豆、鶏肉、豚肉,1食分（160ｇ）当たり,215,10.7,13.9,11.7,0,,無,170,130,25,
4.90411E+12,541,＄中村屋　本格四川怪味炒めソース　１００ｇ,220,20150622,5,8,５４０日,18,100,218,360,273,4000,しょうゆ、砂糖、醸造酢、食用油脂（なたね油、ごま油）、白ごま、ラー油、水飴、チキンブイヨン、香辛料、豆チ、ピーナッツバター、発酵調味料、食塩、アーモンドパウダー、カシューナッツペースト、しょうが、増粘剤（加工でん粉、キサンタン）、調味料、他,乳、小麦、落花生、カシューナッツ、ごま、大豆、鶏肉,１袋（100ｇ）あたり,321,4.7,23.8,22.1,1643,増粘剤、調味料、香辛料抽出物、他,無,170,130,20,
4.90411E+12,541,＄中村屋　本格四川怪味かけソース　１００ｇ,220,20150622,5,8,５４０日,18,100,218,360,273,4000,しょうゆ、鶏肉、砂糖、白ごま、醸造酢、ごま油、りんご酢、ピーナッツバター、乾燥オニオン、豆板醤、チキンブイヨン、マー油、香辛料、ラー油、カシューナッツパウダー、食塩、トレハロース、調味料（アミノ酸等）、増粘剤（加工でん粉）、酸味料、他,乳、小麦、落花生、カシューナッツ、ごま、大豆、鶏肉、豚肉、りんご,１袋（100ｇ）あたり,196,5.2,13.1,14.2,1247,トレハロース、調味料、増粘剤、酸味料、他,無,170,130,20,
4.90411E+12,541,中村屋　本格四川胡麻のコクと山椒香る鶏肉の旨辛炒め,220,20160215,5,8,５４０日,18,100,218,360,273,4000,しょうゆ、砂糖、醸造酢、食用油脂（なたね油、ごま油）、白ごま、ラー油、水飴、チキンブイヨン、香辛料、豆鼓、ピーナッツバター、発酵調味料、食塩、アーモンドパウダー、カシューナッツペースト、しょうが、増粘剤（加工でん粉、キサンタン）、調味料（アミノ酸等）、香辛料抽出物、酸味料、パプリカ色素、（原材料の一部に乳成分、小麦を含む）,乳、落花生、カシューナッツ、ごま、大豆、鶏肉,１人分（３４ｇ）当たり,109,1.6,8.1,7.5,559,増粘剤（加工でん粉、キサンタン）　他,無,170,130,20,
4.90411E+12,541,中村屋　本格四川　香りとコク、かさなる麻婆茄子,220,20160215,5,8,５４０日,18,140,218,360,273,5600,食肉（鶏肉、豚肉）、トマトペースト、ヨーグルト、なたね油、野菜（しょうが、にんにく）、豆板醤、粒状植物性たん白、砂糖、水飴、しょうゆ、醸造酢、甜醤油（砂糖、しょうゆ、紹興酒、その他）、チキンブイヨン、魚醤、豆鼓、食塩、ほたて貝エキス、ＸＯ醤、香辛料、トレハロース、調味料（アミノ酸等）、増粘剤（加工でん粉、キサンタン）、着色料（パプリカ色素、ココア、紅麹、ラック）、香料、（原材料の一部に小麦、えび、ごまを含む）　別添スパイス／さんしょう,乳、小麦、えび、ごま、大豆、鶏肉、豚肉,１人分（４７ｇ）当たり,75,3.2,3.7,7.1,514,増粘剤（加工でん粉、キサンタン）他,無,170,130,20,
4.90411E+12,541,＄中村屋　本格中華炒め玉子の蟹あんかけ　１５０ｇ,220,20160815,5,8,５４０日,18,150,218,360,273,6000,野菜（たけのこ、玉ねぎ）、かに風味かまぼこ、しいたけ水煮、香味油、ラード、かに、合成清酒、砂糖、食塩、チキンブイヨン、かにエキス、ほたて貝エキス、香辛料、増粘剤（加工でん粉、増粘多糖類）、調味料（アミノ酸等）、セルロース、香料、香辛料抽出物、着色料（紅麹）、（原材料の一部に卵、乳成分、小麦、えび、大豆、豚肉を含む）,卵、乳、小麦、えび、かに、大豆、鶏肉、豚肉,1人分(50g)当り,33,0.8,2,3,237,,無,170,130,20,
4.90411E+12,541,＄中村屋　本格中華炒め玉子フカヒレあんかけ１５０ｇ,220,20160815,5,8,５４０日,18,150,218,360,273,6000,野菜（たけのこ、にんにく、しょうが）、ゼラチン加工品、しいたけ水煮、しょうゆ、砂糖、香味油、ごま油、春雨、甜醤油（砂糖、しょうゆ、紹興酒、その他）、オイスターソース、ほたて貝エキス、発酵調味料、ポークブイヨン、食塩、豆板醤、あわびエキス、ふかひれ、増粘剤（加工でん粉、増粘多糖類）、調味料（アミノ酸等）、ゲル化剤（アルギン酸Ｎａ）、（原材料の一部に乳成分、小麦を含む）,乳、小麦、あわび、ごま、大豆、豚肉、ゼラチン,1人分(50g)当り,32,0.9,1.4,3.9,273,,無,170,130,20,
